{"action_profile":"core-1-3-5","anonymous":false,"canonical_radius_histogram":[{"count":13,"lower":0.0,"upper":0.1,"upper_inclusive":false},{"count":0,"lower":0.1,"upper":0.2,"upper_inclusive":false},{"count":0,"lower":0.2,"upper":0.3,"upper_inclusive":false},{"count":23,"lower":0.3,"upper":0.4,"upper_inclusive":false},{"count":1,"lower":0.4,"upper":0.5,"upper_inclusive":false},{"count":0,"lower":0.5,"upper":0.6,"upper_inclusive":false},{"count":3,"lower":0.6,"upper":0.7,"upper_inclusive":false},{"count":0,"lower":0.7,"upper":0.8,"upper_inclusive":false},{"count":0,"lower":0.8,"upper":0.9,"upper_inclusive":false},{"count":0,"lower":0.9,"upper":1.0,"upper_inclusive":true}],"constraint_model":"default","credential_counts":{"certificate":0,"federated_trust":30,"key":0,"passkey":0,"password":10,"token":0},"edge_counts":{"assigned":51,"authenticates_as":40,"can_assume":2,"can_read_secret":1,"constrained_by":1,"grants":85,"member_of":29},"metric_profile":"1.0-draft","node_counts":{"binding":51,"constraint":5,"credential":40,"principal":43,"resource":24},"normalizer_profile":"unasserted","principal_counts":{"ai_agent":10,"group":3,"human_user":10,"managed_identity":5,"service_principal":10,"workload_identity":5},"privacy_reviewed":false,"schema_version":"0.1","structural_features":{"constrained_item_count":9,"eligible_binding_count":2,"shared_binding_count":0},"submission_enabled":false,"summary_version":"1.0-draft","synthetic":true}
